{
 "case_id": "K26",
 "taxonomy_sha256": "7ec912aa92d8d1a6f54a6158550c0bcfa48861a05bbf6f6146b5b93b1f9bfeaa",
 "brief_literal": "Transferencia de estilo: el vaso de K05 (contenido, Image 1) con el estilo de la bahía de K02 (Image 2): su paleta de gris acero, azul pizarra y franjas ámbar, su contraluz lateral duro, sus sombras sin relleno, su contraste alto y su bruma fina. No se copia el contenido de K02. Key visual. Plantilla: gpt-image.md Style Transfer (INV-002389–002390), referencias con rol (INV-002386–002388).",
 "campos": [
  {
   "path": "entrada.pieza.tipo",
   "valor": "key visual de campaña",
   "origen": "USUARIO",
   "option_ids": [
    "TRM-0005"
   ],
   "evidencia": "lista de casos aprobada por Eric (DECISIONES_ERIC_20261026 §16, §17; prueba/casos.json)",
   "confirmado": false
  },
  {
   "path": "entrada.operacion",
   "valor": "transferencia de estilo",
   "origen": "USUARIO",
   "option_ids": [
    "OPT-712ffa652cfe"
   ],
   "evidencia": "lista de casos aprobada por Eric (DECISIONES_ERIC_20261026 §16, §17; prueba/casos.json)",
   "confirmado": false
  },
  {
   "path": "entrada.sujetos.items[].clase",
   "valor": "producto",
   "origen": "USUARIO",
   "option_ids": [
    "OPT-6897c539340a"
   ],
   "evidencia": "lista de casos aprobada por Eric (DECISIONES_ERIC_20261026 §16, §17; prueba/casos.json)",
   "confirmado": false
  },
  {
   "path": "entrada.selecciones_taxonomicas",
   "valor": "sin texto",
   "origen": "USUARIO",
   "option_ids": [],
   "evidencia": "lista de casos aprobada por Eric (DECISIONES_ERIC_20261026 §16, §17; prueba/casos.json); valor de extensión aprobada sin id en el catálogo (DECISIONES_ERIC_20261023 §4)",
   "confirmado": false
  },
  {
   "path": "entrada.escena",
   "valor": {
    "espacio": "interior",
    "entorno": "superficie de piedra oscura mojada y fondo degradado gris tormenta"
   },
   "origen": "INFERENCIA_PROPUESTA",
   "option_ids": [],
   "evidencia": "propuesta del sistema para el caso K26 (PLAN_FINAL_PRUEBA.md §4), para aprobación de Eric",
   "confirmado": false
  },
  {
   "path": "entrada.camara",
   "valor": {
    "plano": "objeto entero",
    "angulo": "eye-level",
    "altura": "frontal, a la altura del vaso",
    "efecto_optico": "nitidez total"
   },
   "origen": "INFERENCIA_PROPUESTA",
   "option_ids": [],
   "evidencia": "propuesta del sistema para el caso K26 (PLAN_FINAL_PRUEBA.md §4), para aprobación de Eric",
   "confirmado": false
  },
  {
   "path": "entrada.luz",
   "valor": {
    "fuente": "una sola luz baja",
    "direccion": "contraluz lateral desde la derecha, como el sol de la imagen 2",
    "dureza": "dura",
    "distribucion": "franjas brillantes en el borde del vidrio y en la superficie mojada, frente del vaso en penumbra",
    "contraste": "alto"
   },
   "origen": "INFERENCIA_PROPUESTA",
   "option_ids": [],
   "evidencia": "propuesta del sistema para el caso K26 (PLAN_FINAL_PRUEBA.md §4), para aprobación de Eric",
   "confirmado": false
  },
  {
   "path": "entrada.sujetos",
   "valor": {
    "cantidad": 1,
    "items": [
     {
      "id": "vaso",
      "clase": "producto",
      "descripcion": "el vaso de la imagen 1: vidrio transparente, recto, liso, sin marca, vacío",
      "posicion": "centrado, frontal"
     }
    ]
   },
   "origen": "INFERENCIA_PROPUESTA",
   "option_ids": [],
   "evidencia": "propuesta del sistema para el caso K26 (PLAN_FINAL_PRUEBA.md §4), para aprobación de Eric",
   "confirmado": false
  },
  {
   "path": "entrada.formato.ratio",
   "valor": "1:1",
   "origen": "INFERENCIA_PROPUESTA",
   "option_ids": [],
   "evidencia": "propuesta del sistema para el caso K26 (PLAN_FINAL_PRUEBA.md §4), para aprobación de Eric",
   "confirmado": false
  }
 ],
 "requisitos_de_completitud": [
  {
   "path": "entrada.sujetos",
   "motivo": "campo exigido por T-GENESIS o el módulo fotografía",
   "resuelto": true
  },
  {
   "path": "entrada.escena",
   "motivo": "campo exigido por T-GENESIS o el módulo fotografía",
   "resuelto": true
  },
  {
   "path": "entrada.camara.plano",
   "motivo": "campo exigido por T-GENESIS o el módulo fotografía",
   "resuelto": true
  },
  {
   "path": "entrada.luz.fuente",
   "motivo": "campo exigido por T-GENESIS o el módulo fotografía",
   "resuelto": true
  },
  {
   "path": "entrada.referencias",
   "motivo": "T-STYLE exige las imágenes de contenido y de estilo con su sha256; aún no existen y se aprueba de nuevo cuando existan (PLAN §5, tarea 3)",
   "resuelto": false
  }
 ],
 "aprobacion": {
  "aprobado": false,
  "evidencia": ""
 }
}
