{
 "case_id": "G2",
 "taxonomy_sha256": "7ec912aa92d8d1a6f54a6158550c0bcfa48861a05bbf6f6146b5b93b1f9bfeaa",
 "brief_literal": "Rostro maestro T1 de una persona inventada (no real), miembro C del grupo de K12. Mujer de unos 24 años, distinta de K01 y de G1 en cara, pelo y vestuario (EN.5). Mismo estudio y misma luz que K01.",
 "campos": [
  {
   "path": "entrada.pieza.tipo",
   "valor": "retrato",
   "origen": "USUARIO",
   "option_ids": [
    "TRM-0008"
   ],
   "evidencia": "lista de casos aprobada por Eric (DECISIONES_ERIC_20261026 §16, §17; prueba/casos.json)",
   "confirmado": false
  },
  {
   "path": "entrada.operacion",
   "valor": "génesis sin referencias (caso 1, T1)",
   "origen": "USUARIO",
   "option_ids": [
    "OPT-a192c35ce4be"
   ],
   "evidencia": "lista de casos aprobada por Eric (DECISIONES_ERIC_20261026 §16, §17; prueba/casos.json)",
   "confirmado": false
  },
  {
   "path": "entrada.accion",
   "valor": "A pose sostenida",
   "origen": "USUARIO",
   "option_ids": [
    "OPT-b54eff520399"
   ],
   "evidencia": "lista de casos aprobada por Eric (DECISIONES_ERIC_20261026 §16, §17; prueba/casos.json)",
   "confirmado": false
  },
  {
   "path": "entrada.sujetos.items[].clase",
   "valor": "persona",
   "origen": "USUARIO",
   "option_ids": [
    "OPT-0925b03503e1"
   ],
   "evidencia": "lista de casos aprobada por Eric (DECISIONES_ERIC_20261026 §16, §17; prueba/casos.json)",
   "confirmado": false
  },
  {
   "path": "entrada.selecciones_taxonomicas",
   "valor": "sin texto",
   "origen": "USUARIO",
   "option_ids": [],
   "evidencia": "lista de casos aprobada por Eric (DECISIONES_ERIC_20261026 §16, §17; prueba/casos.json); valor de extensión aprobada sin id en el catálogo (DECISIONES_ERIC_20261023 §4)",
   "confirmado": false
  },
  {
   "path": "entrada.escena",
   "valor": {
    "espacio": "interior",
    "entorno": "estudio con fondo continuo gris claro liso"
   },
   "origen": "INFERENCIA_PROPUESTA",
   "option_ids": [],
   "evidencia": "propuesta del sistema para el caso G2 (PLAN_FINAL_PRUEBA.md §4), para aprobación de Eric",
   "confirmado": false
  },
  {
   "path": "entrada.camara",
   "valor": {
    "plano": "CU close-up",
    "angulo": "eye-level",
    "efecto_optico": "profundidad de campo corta",
    "lente_intencion": "85mm feel, sin distorsión de gran angular en la cara"
   },
   "origen": "INFERENCIA_PROPUESTA",
   "option_ids": [],
   "evidencia": "propuesta del sistema para el caso G2 (PLAN_FINAL_PRUEBA.md §4), para aprobación de Eric",
   "confirmado": false
  },
  {
   "path": "entrada.luz",
   "valor": {
    "fuente": "una sola luz dura",
    "direccion": "lateral desde la izquierda de cámara, rasante",
    "dureza": "dura",
    "distribucion": "el lado de sombra queda uno o dos pasos más oscuro, sin relleno",
    "contraste": "alto"
   },
   "origen": "INFERENCIA_PROPUESTA",
   "option_ids": [],
   "evidencia": "propuesta del sistema para el caso G2 (PLAN_FINAL_PRUEBA.md §4), para aprobación de Eric",
   "confirmado": false
  },
  {
   "path": "entrada.sujetos",
   "valor": {
    "cantidad": 1,
    "items": [
     {
      "id": "mujer_joven",
      "clase": "persona",
      "descripcion": "mujer de unos 24 años, rostro alargado e irregular",
      "edad": 24,
      "genero": "mujer",
      "rasgos": [
       "nariz ancha",
       "cejas gruesas y rectas",
       "lunar pequeño sobre el lado izquierdo del labio superior",
       "frente amplia"
      ],
      "cabello": "negro, rizado y voluminoso, recogido con una pinza y rizos sueltos en las sienes",
      "vestuario": "suéter de punto acanalado color mostaza de cuello alto",
      "expresion": "neutra, boca cerrada",
      "posicion": "centrada, cuerpo girado tres cuartos, mirada a cámara"
     }
    ]
   },
   "origen": "INFERENCIA_PROPUESTA",
   "option_ids": [],
   "evidencia": "propuesta del sistema para el caso G2 (PLAN_FINAL_PRUEBA.md §4), para aprobación de Eric",
   "confirmado": false
  },
  {
   "path": "entrada.formato.ratio",
   "valor": "4:5",
   "origen": "INFERENCIA_PROPUESTA",
   "option_ids": [],
   "evidencia": "propuesta del sistema para el caso G2 (PLAN_FINAL_PRUEBA.md §4), para aprobación de Eric",
   "confirmado": false
  }
 ],
 "requisitos_de_completitud": [
  {
   "path": "entrada.sujetos",
   "motivo": "campo exigido por T-GENESIS o el módulo fotografía",
   "resuelto": true
  },
  {
   "path": "entrada.escena",
   "motivo": "campo exigido por T-GENESIS o el módulo fotografía",
   "resuelto": true
  },
  {
   "path": "entrada.camara.plano",
   "motivo": "campo exigido por T-GENESIS o el módulo fotografía",
   "resuelto": true
  },
  {
   "path": "entrada.luz.fuente",
   "motivo": "campo exigido por T-GENESIS o el módulo fotografía",
   "resuelto": true
  }
 ],
 "aprobacion": {
  "aprobado": false,
  "evidencia": ""
 }
}
