{
 "case_id": "K18",
 "taxonomy_sha256": "7ec912aa92d8d1a6f54a6158550c0bcfa48861a05bbf6f6146b5b93b1f9bfeaa",
 "brief_literal": "Restaurar la copia dañada de E6: reparar rotura, pliegue, rayones, mancha y desvanecido, y recuperar nitidez y contraste, conservando el carácter y el grano de la época. Plantilla: editing.md:65–71.",
 "campos": [
  {
   "path": "entrada.pieza.tipo",
   "valor": "editorial",
   "origen": "USUARIO",
   "option_ids": [
    "TRM-0004"
   ],
   "evidencia": "lista de casos aprobada por Eric (DECISIONES_ERIC_20261026 §16, §17; prueba/casos.json)",
   "confirmado": false
  },
  {
   "path": "entrada.operacion",
   "valor": "edición: restaurar",
   "origen": "USUARIO",
   "option_ids": [],
   "evidencia": "lista de casos aprobada por Eric (DECISIONES_ERIC_20261026 §16, §17; prueba/casos.json); valor de extensión aprobada sin id en el catálogo (DECISIONES_ERIC_20261023 §4)",
   "confirmado": false
  },
  {
   "path": "entrada.sujetos.items[].clase",
   "valor": "persona",
   "origen": "USUARIO",
   "option_ids": [
    "OPT-0925b03503e1"
   ],
   "evidencia": "lista de casos aprobada por Eric (DECISIONES_ERIC_20261026 §16, §17; prueba/casos.json)",
   "confirmado": false
  },
  {
   "path": "entrada.selecciones_taxonomicas",
   "valor": "sin texto",
   "origen": "USUARIO",
   "option_ids": [],
   "evidencia": "lista de casos aprobada por Eric (DECISIONES_ERIC_20261026 §16, §17; prueba/casos.json); valor de extensión aprobada sin id en el catálogo (DECISIONES_ERIC_20261023 §4)",
   "confirmado": false
  },
  {
   "path": "entrada.edicion",
   "valor": {
    "cambio": "restaurar la copia: reparar la rotura, el pliegue, los rayones, la mancha de agua y el desvanecido, y recuperar nitidez y contraste",
    "preservar": [
     "rostro e identidad",
     "peinado",
     "pose y expresión",
     "blusa y collar",
     "tono sepia",
     "grano original de la época",
     "encuadre"
    ]
   },
   "origen": "INFERENCIA_PROPUESTA",
   "option_ids": [],
   "evidencia": "propuesta del sistema para el caso K18 (PLAN_FINAL_PRUEBA.md §4), para aprobación de Eric",
   "confirmado": false
  },
  {
   "path": "entrada.formato.ratio",
   "valor": "4:5",
   "origen": "INFERENCIA_PROPUESTA",
   "option_ids": [],
   "evidencia": "propuesta del sistema para el caso K18 (PLAN_FINAL_PRUEBA.md §4), para aprobación de Eric",
   "confirmado": false
  }
 ],
 "requisitos_de_completitud": [
  {
   "path": "entrada.edicion.cambio",
   "motivo": "campo exigido por T-EDIT",
   "resuelto": true
  },
  {
   "path": "entrada.edicion.preservar",
   "motivo": "campo exigido por T-EDIT",
   "resuelto": true
  },
  {
   "path": "entrada.referencias",
   "motivo": "T-EDIT exige la imagen a editar con su sha256; la imagen aún no existe y se aprueba de nuevo cuando exista (PLAN §5, tarea 3)",
   "resuelto": false
  }
 ],
 "aprobacion": {
  "aprobado": false,
  "evidencia": ""
 }
}
