{
 "case_id": "K13",
 "taxonomy_sha256": "7ec912aa92d8d1a6f54a6158550c0bcfa48861a05bbf6f6146b5b93b1f9bfeaa",
 "brief_literal": "Multipanel 2x2 editorial de la mujer de K01 con la plantilla «2x2 Editorial Portrait Grid» de `multi-panel.md`: arriba a la izquierda retrato frontal, arriba a la derecha macro del rostro, abajo a la izquierda ángulo bajo, abajo a la derecha perfil. Misma persona y vestuario en los cuatro paneles, con su maestro de rostro adjunto.",
 "campos": [
  {
   "path": "entrada.pieza.tipo",
   "valor": "storyboard o multipanel",
   "origen": "USUARIO",
   "option_ids": [
    "OPT-35626ba2ee1f"
   ],
   "evidencia": "lista de casos aprobada por Eric (DECISIONES_ERIC_20261026 §16, §17; prueba/casos.json)",
   "confirmado": false
  },
  {
   "path": "entrada.operacion",
   "valor": "composición de varias referencias",
   "origen": "USUARIO",
   "option_ids": [
    "OPT-389218bf07f0"
   ],
   "evidencia": "lista de casos aprobada por Eric (DECISIONES_ERIC_20261026 §16, §17; prueba/casos.json)",
   "confirmado": false
  },
  {
   "path": "entrada.accion",
   "valor": "A pose sostenida",
   "origen": "USUARIO",
   "option_ids": [
    "OPT-b54eff520399"
   ],
   "evidencia": "lista de casos aprobada por Eric (DECISIONES_ERIC_20261026 §16, §17; prueba/casos.json)",
   "confirmado": false
  },
  {
   "path": "entrada.sujetos.items[].clase",
   "valor": "persona",
   "origen": "USUARIO",
   "option_ids": [
    "OPT-0925b03503e1"
   ],
   "evidencia": "lista de casos aprobada por Eric (DECISIONES_ERIC_20261026 §16, §17; prueba/casos.json)",
   "confirmado": false
  },
  {
   "path": "entrada.selecciones_taxonomicas",
   "valor": "sin texto",
   "origen": "USUARIO",
   "option_ids": [],
   "evidencia": "lista de casos aprobada por Eric (DECISIONES_ERIC_20261026 §16, §17; prueba/casos.json); valor de extensión aprobada sin id en el catálogo (DECISIONES_ERIC_20261023 §4)",
   "confirmado": false
  },
  {
   "path": "entrada.escena",
   "valor": {
    "espacio": "interior",
    "entorno": "estudio con fondo continuo gris claro liso, el mismo en los cuatro paneles"
   },
   "origen": "INFERENCIA_PROPUESTA",
   "option_ids": [],
   "evidencia": "propuesta del sistema para el caso K13 (PLAN_FINAL_PRUEBA.md §4), para aprobación de Eric",
   "confirmado": false
  },
  {
   "path": "entrada.camara",
   "valor": {
    "plano": "arriba izquierda CU close-up de hombros arriba; arriba derecha ECU extreme close-up macro del rostro; abajo izquierda CU close-up desde abajo; abajo derecha CU close-up de perfil",
    "angulo": "eye-level arriba; low abajo a la izquierda; perfil abajo a la derecha",
    "efecto_optico": "profundidad de campo corta en cada panel; separación mínima entre paneles",
    "lente_intencion": "85mm feel; macro en el panel de arriba a la derecha"
   },
   "origen": "INFERENCIA_PROPUESTA",
   "option_ids": [],
   "evidencia": "propuesta del sistema para el caso K13 (PLAN_FINAL_PRUEBA.md §4), para aprobación de Eric",
   "confirmado": false
  },
  {
   "path": "entrada.luz",
   "valor": {
    "fuente": "una sola luz dura",
    "direccion": "lateral desde la izquierda de cámara, rasante, la misma en los cuatro paneles",
    "dureza": "dura",
    "distribucion": "el lado de sombra queda uno o dos pasos más oscuro, sin relleno",
    "contraste": "alto"
   },
   "origen": "INFERENCIA_PROPUESTA",
   "option_ids": [],
   "evidencia": "propuesta del sistema para el caso K13 (PLAN_FINAL_PRUEBA.md §4), para aprobación de Eric",
   "confirmado": false
  },
  {
   "path": "entrada.sujetos",
   "valor": {
    "cantidad": 1,
    "items": [
     {
      "id": "mujer",
      "clase": "persona",
      "descripcion": "la mujer de la imagen 1 (K01), una vez en cada panel",
      "edad": 35,
      "genero": "mujer",
      "cabello": "castaño oscuro a la altura de la mandíbula, como en la imagen 1",
      "vestuario": "camiseta de algodón gris carbón, como en la imagen 1",
      "expresion": "neutra en tres paneles; segura, con el mentón un poco levantado, abajo a la izquierda",
      "posicion": "arriba izquierda de frente con mirada a cámara; arriba derecha rostro en macro; abajo izquierda vista desde abajo; abajo derecha de perfil"
     }
    ]
   },
   "origen": "INFERENCIA_PROPUESTA",
   "option_ids": [],
   "evidencia": "propuesta del sistema para el caso K13 (PLAN_FINAL_PRUEBA.md §4), para aprobación de Eric",
   "confirmado": false
  },
  {
   "path": "entrada.formato.ratio",
   "valor": "1:1",
   "origen": "INFERENCIA_PROPUESTA",
   "option_ids": [],
   "evidencia": "propuesta del sistema para el caso K13 (PLAN_FINAL_PRUEBA.md §4), para aprobación de Eric",
   "confirmado": false
  }
 ],
 "requisitos_de_completitud": [
  {
   "path": "entrada.sujetos",
   "motivo": "campo exigido por T-GENESIS o el módulo fotografía",
   "resuelto": true
  },
  {
   "path": "entrada.escena",
   "motivo": "campo exigido por T-GENESIS o el módulo fotografía",
   "resuelto": true
  },
  {
   "path": "entrada.camara.plano",
   "motivo": "campo exigido por T-GENESIS o el módulo fotografía",
   "resuelto": true
  },
  {
   "path": "entrada.luz.fuente",
   "motivo": "campo exigido por T-GENESIS o el módulo fotografía",
   "resuelto": true
  },
  {
   "path": "entrada.referencias",
   "motivo": "T-REF-COMP exige referencia real con sha256; la imagen de entrada aún no existe y se aprueba de nuevo cuando exista (PLAN §5, tarea 3)",
   "resuelto": false
  }
 ],
 "aprobacion": {
  "aprobado": false,
  "evidencia": ""
 }
}
