{
 "case_id": "K24",
 "taxonomy_sha256": "7ec912aa92d8d1a6f54a6158550c0bcfa48861a05bbf6f6146b5b93b1f9bfeaa",
 "brief_literal": "Llenar con física el vaso de K05: agua mineral con gas hasta tres cuartos de la altura del vaso, con refracción, menisco, burbujas finas y condensación en el vidrio, con la misma luz. Plantilla: editing.md:91–95 (TRM-1142).",
 "campos": [
  {
   "path": "entrada.pieza.tipo",
   "valor": "e-commerce o catálogo",
   "origen": "USUARIO",
   "option_ids": [
    "OPT-d85b912977de"
   ],
   "evidencia": "lista de casos aprobada por Eric (DECISIONES_ERIC_20261026 §16, §17; prueba/casos.json)",
   "confirmado": false
  },
  {
   "path": "entrada.operacion",
   "valor": "edición de imagen existente (T5)",
   "origen": "USUARIO",
   "option_ids": [
    "OPT-239ffd2cc2a9"
   ],
   "evidencia": "lista de casos aprobada por Eric (DECISIONES_ERIC_20261026 §16, §17; prueba/casos.json)",
   "confirmado": false
  },
  {
   "path": "entrada.sujetos.items[].clase",
   "valor": "producto",
   "origen": "USUARIO",
   "option_ids": [
    "OPT-6897c539340a"
   ],
   "evidencia": "lista de casos aprobada por Eric (DECISIONES_ERIC_20261026 §16, §17; prueba/casos.json)",
   "confirmado": false
  },
  {
   "path": "entrada.selecciones_taxonomicas",
   "valor": "sin texto",
   "origen": "USUARIO",
   "option_ids": [],
   "evidencia": "lista de casos aprobada por Eric (DECISIONES_ERIC_20261026 §16, §17; prueba/casos.json); valor de extensión aprobada sin id en el catálogo (DECISIONES_ERIC_20261023 §4)",
   "confirmado": false
  },
  {
   "path": "entrada.edicion",
   "valor": {
    "cambio": "llenar el vaso con agua mineral con gas hasta tres cuartos de su altura, con refracción del fondo a través del agua, menisco en el borde del líquido, burbujas finas y condensación en el vidrio, con la luz existente",
    "preservar": [
     "forma, tamaño y posición del vaso",
     "fondo y superficie blancos",
     "luces laterales y trasera",
     "sombra de contacto suave",
     "encuadre"
    ]
   },
   "origen": "INFERENCIA_PROPUESTA",
   "option_ids": [],
   "evidencia": "propuesta del sistema para el caso K24 (PLAN_FINAL_PRUEBA.md §4), para aprobación de Eric",
   "confirmado": false
  },
  {
   "path": "entrada.formato.ratio",
   "valor": "1:1",
   "origen": "INFERENCIA_PROPUESTA",
   "option_ids": [],
   "evidencia": "propuesta del sistema para el caso K24 (PLAN_FINAL_PRUEBA.md §4), para aprobación de Eric",
   "confirmado": false
  }
 ],
 "requisitos_de_completitud": [
  {
   "path": "entrada.edicion.cambio",
   "motivo": "campo exigido por T-EDIT",
   "resuelto": true
  },
  {
   "path": "entrada.edicion.preservar",
   "motivo": "campo exigido por T-EDIT",
   "resuelto": true
  },
  {
   "path": "entrada.referencias",
   "motivo": "T-EDIT exige la imagen a editar con su sha256; la imagen aún no existe y se aprueba de nuevo cuando exista (PLAN §5, tarea 3)",
   "resuelto": false
  }
 ],
 "aprobacion": {
  "aprobado": false,
  "evidencia": ""
 }
}
