{
 "case_id": "E5",
 "taxonomy_sha256": "7ec912aa92d8d1a6f54a6158550c0bcfa48861a05bbf6f6146b5b93b1f9bfeaa",
 "brief_literal": "Entrada de K17 (colorizar): retrato de estudio en blanco y negro de los años cincuenta de una persona inventada (no real). Hombre de unos 30 años, cabeza y hombros, traje oscuro y corbata, luz dura de estudio. Su QA solo comprueba que es blanco y negro y sirve de entrada.",
 "campos": [
  {
   "path": "entrada.pieza.tipo",
   "valor": "editorial",
   "origen": "INFERENCIA_PROPUESTA",
   "option_ids": [
    "TRM-0004"
   ],
   "evidencia": "propuesta del sistema para la entrada E5 (PLAN §4, tabla de entradas: «foto en blanco y negro de una persona»; génesis escrita por el armador)",
   "confirmado": false
  },
  {
   "path": "entrada.operacion",
   "valor": "génesis sin referencias (caso 1, T1)",
   "origen": "INFERENCIA_PROPUESTA",
   "option_ids": [
    "OPT-a192c35ce4be"
   ],
   "evidencia": "propuesta del sistema para la entrada E5 (PLAN §4, tabla de entradas: «foto en blanco y negro de una persona»; génesis escrita por el armador)",
   "confirmado": false
  },
  {
   "path": "entrada.accion",
   "valor": "A pose sostenida",
   "origen": "INFERENCIA_PROPUESTA",
   "option_ids": [
    "OPT-b54eff520399"
   ],
   "evidencia": "propuesta del sistema para la entrada E5 (PLAN §4, tabla de entradas: «foto en blanco y negro de una persona»; génesis escrita por el armador)",
   "confirmado": false
  },
  {
   "path": "entrada.sujetos.items[].clase",
   "valor": "persona",
   "origen": "INFERENCIA_PROPUESTA",
   "option_ids": [
    "OPT-0925b03503e1"
   ],
   "evidencia": "propuesta del sistema para la entrada E5 (PLAN §4, tabla de entradas: «foto en blanco y negro de una persona»; génesis escrita por el armador)",
   "confirmado": false
  },
  {
   "path": "entrada.selecciones_taxonomicas",
   "valor": "sin texto",
   "origen": "INFERENCIA_PROPUESTA",
   "option_ids": [],
   "evidencia": "propuesta del sistema para la entrada E5 (PLAN §4, tabla de entradas: «foto en blanco y negro de una persona»; génesis escrita por el armador); valor de extensión aprobada sin id en el catálogo (DECISIONES_ERIC_20261023 §4)",
   "confirmado": false
  },
  {
   "path": "entrada.escena",
   "valor": {
    "espacio": "interior",
    "entorno": "estudio fotográfico de los años cincuenta con fondo pintado gris moteado"
   },
   "origen": "INFERENCIA_PROPUESTA",
   "option_ids": [],
   "evidencia": "propuesta del sistema para el caso E5 (PLAN_FINAL_PRUEBA.md §4), para aprobación de Eric",
   "confirmado": false
  },
  {
   "path": "entrada.camara",
   "valor": {
    "plano": "CU close-up",
    "angulo": "eye-level",
    "efecto_optico": "profundidad de campo corta",
    "lente_intencion": "85mm feel"
   },
   "origen": "INFERENCIA_PROPUESTA",
   "option_ids": [],
   "evidencia": "propuesta del sistema para el caso E5 (PLAN_FINAL_PRUEBA.md §4), para aprobación de Eric",
   "confirmado": false
  },
  {
   "path": "entrada.luz",
   "valor": {
    "fuente": "una luz dura de estudio",
    "direccion": "desde arriba a la izquierda de cámara",
    "dureza": "dura",
    "distribucion": "sombra en lazo bajo la nariz, fondo con luz suave",
    "contraste": "alto"
   },
   "origen": "INFERENCIA_PROPUESTA",
   "option_ids": [],
   "evidencia": "propuesta del sistema para el caso E5 (PLAN_FINAL_PRUEBA.md §4), para aprobación de Eric",
   "confirmado": false
  },
  {
   "path": "entrada.sujetos",
   "valor": {
    "cantidad": 1,
    "items": [
     {
      "id": "hombre",
      "clase": "persona",
      "descripcion": "hombre de unos 30 años de los años cincuenta",
      "edad": 30,
      "genero": "hombre",
      "rasgos": [
       "nariz algo desviada",
       "hoyuelo en el mentón",
       "lunar pequeño en la mejilla izquierda",
       "cara ovalada"
      ],
      "cabello": "oscuro y ondulado, peinado hacia atrás con brillantina",
      "vestuario": "saco de lana oscuro, camisa blanca y corbata angosta estampada",
      "expresion": "tranquila, boca cerrada",
      "posicion": "centrado, cuerpo girado tres cuartos, mirada junto a la lente"
     }
    ]
   },
   "origen": "INFERENCIA_PROPUESTA",
   "option_ids": [],
   "evidencia": "propuesta del sistema para el caso E5 (PLAN_FINAL_PRUEBA.md §4), para aprobación de Eric",
   "confirmado": false
  },
  {
   "path": "entrada.formato.ratio",
   "valor": "4:5",
   "origen": "INFERENCIA_PROPUESTA",
   "option_ids": [],
   "evidencia": "propuesta del sistema para el caso E5 (PLAN_FINAL_PRUEBA.md §4), para aprobación de Eric",
   "confirmado": false
  }
 ],
 "requisitos_de_completitud": [
  {
   "path": "entrada.sujetos",
   "motivo": "campo exigido por T-GENESIS o el módulo fotografía",
   "resuelto": true
  },
  {
   "path": "entrada.escena",
   "motivo": "campo exigido por T-GENESIS o el módulo fotografía",
   "resuelto": true
  },
  {
   "path": "entrada.camara.plano",
   "motivo": "campo exigido por T-GENESIS o el módulo fotografía",
   "resuelto": true
  },
  {
   "path": "entrada.luz.fuente",
   "motivo": "campo exigido por T-GENESIS o el módulo fotografía",
   "resuelto": true
  }
 ],
 "aprobacion": {
  "aprobado": false,
  "evidencia": ""
 }
}
